<!ELEMENT patient (id,created_at,updated_at,deleted_at,title,surname,forenames,name,birth_date,sex,email,phone,postal_address_as_full_text,country_as_iso_3166_1_alpha_2,postcode,united_kingdom_nhs_number,full_time_education,pregnancy_status)>
<!ELEMENT id (#PCDATA)>
<!ELEMENT created_at (#PCDATA)>
<!ELEMENT updated_at (#PCDATA)>
<!ELEMENT deleted_at (#PCDATA)>
<!ELEMENT title (#PCDATA)>
<!ELEMENT surname (#PCDATA)>
<!ELEMENT forenames (#PCDATA)>
<!ELEMENT name (#PCDATA)>
<!ELEMENT birth_date (#PCDATA)>
<!ELEMENT sex (#PCDATA)>
<!ELEMENT email (#PCDATA)>
<!ELEMENT phone (#PCDATA)>
<!ELEMENT postal_address_as_full_text (#PCDATA)>
<!ELEMENT country_as_iso_3166_1_alpha_2 (#PCDATA)>
<!ELEMENT postcode (#PCDATA)>
<!ELEMENT united_kingdom_nhs_number (#PCDATA)>
<!ELEMENT full_time_education (#PCDATA)>
<!ELEMENT pregnancy_status (#PCDATA)>
