<?xml version="1.0" encoding="UTF-8"?>
<!DOCTYPE patient SYSTEM "patient.dtd">
<patient>
<id>550e8400-e29b-41d4-a716-446655440000</id>
<created_at>2026-04-09T10:00:00Z</created_at>
<updated_at>2026-04-09T10:00:00Z</updated_at>
<deleted_at>2026-04-09T10:00:00Z</deleted_at>
<name>Example</name>
<birth_date>2026-01-15</birth_date>
<email>jane.doe@example.com</email>
<phone>07700900000</phone>
<postal_address_as_full_text>Example text.</postal_address_as_full_text>
<country_as_iso_3166_1_alpha_2></country_as_iso_3166_1_alpha_2>
<postcode>SW1A 1AA</postcode>
<united_kingdom_nhs_number>mg/dL</united_kingdom_nhs_number>
<employer_name>Example</employer_name>
<occupation>Teacher</occupation>
</patient>
